{
  "$schema": "http://json-schema.org/draft-07/schema#",
  "$id": "templates_file.schema.json",
  "title": "Template registry",
  "type": "array",
  "items": {
    "type": "object",
    "required": ["template_id", "name", "file"],
    "properties": {
      "template_id": { "type": "string" },
      "name": { "type": "string" },
      "file": { "type": "string" },
      "language": { "type": "string" },
      "description": { "type": "string" }
    },
    "additionalProperties": false
  }
}
